card_name,issuer,card_type,annual_fee,annual_fee_year_1,annual_fee_year_2_plus,reward_model,card_family,cashback_rate_display,cashback_rate_effective,signup_bonus,signup_bonus_type,estimated_bonus_value_usd,intro_apr_purchase,foreign_tx_fee,best_for,why_this_card_exiss,pros,cons
BankAmericard Cash Rewards,Bank of America,personal,0,0,0,cashback,,3 / 2 / 1,1.6,150,dollars,150,0% for 15 months,Yes,Online shopping and category bonuses with long intro APR for balance transfers,Combines cash back earning with 0% intro period for users managing existing debt while earning rewards,3% on category of choice; 2% at grocery stores and wholesale clubs; 1% elsewhere; 0% intro APR for 15 months; Preferred Rewards boost,3% capped at $2500/quarter; foreign transaction fee; must choose category; rewards value maximized with BoA banking relationship
Bank of America Travel Rewards,Bank of America,personal,0,0,0,travel,,1.5,1.5,250,points,2,0% for 15 months,No,No-fee travel card with no foreign transaction fees and simple earning,Entry travel card for BoA customers wanting flexible points redemption without annual cost,Unlimited 1.5 points per dollar; no foreign transaction fees; points redeem toward travel statement credits; Preferred Rewards boost up to 2.625 points; 0% intro APR,Lower earn rate than premium travel cards; points not transferable to partners; Preferred Rewards boost requires BoA banking; redemption limited to travel purchases
Bank of America Premium Rewards,Bank of America,personal,95,95,95,travel,,1.5,1.5,600,points,6,,No,Premium travel and dining earning for Bank of America Preferred Rewards members,Mid-tier travel card optimized for BoA banking customers with points boost and travel credits,2 points on travel and dining; 1.5 elsewhere; $100 annual airline incidental credit; no foreign transaction fee; points transfer or redeem for travel,$95 annual fee; value heavily dependent on Preferred Rewards status; airline credit narrow; transfer partners limited vs Chase/Amex
Bank of America Business Advantage Travel Rewards,Bank of America,business,0,0,0,travel,,1.5,1.5,25000,points,250,0% for 9 months,No,No-fee business travel card with straightforward earning and no foreign transaction fees,Entry business travel option for BoA business banking customers wanting simple points accumulation,Unlimited 1.5 points per dollar on all business purchases; no foreign transaction fee; no annual fee; 0% intro APR for 9 months; points redeem for travel,Lower earn rate than premium business travel cards; points not transferable to airline/hotel partners; best value with BoA Business Advantage Relationship Rewards; limited premium perks
Bank of America Business Advantage Atmos Rewards,Bank of America,business,95,0,95,cashback,Alaska,3 / 2 / 1,1.7,50000,dollars,500,0% for 9 months,Yes,Flexible business category earning with annual fee waived first year,Category-focused business card with first-year value and BoA banking synergy,3% cash back on category of choice; 2% at grocery stores and wholesale clubs; 1% elsewhere; first year no annual fee; Relationship Rewards boost; 0% intro APR,Annual fee $95 after first year; 3% capped at $50k/year combined; foreign transaction fee; must choose one category; best with BoA business banking
Bank of America Business Advantage Customized Cash Rewards,Bank of America,business,0,0,0,cashback,,3 / 2 / 1,1.7,30000,dollars,300,0% for 9 months,Yes,Choose your own 3% business category for targeted spending optimization,No-fee business cash back with category choice for expense concentration,3% cash back on category of choice; 2% at grocery stores and wholesale clubs; 1% elsewhere; no annual fee; Relationship Rewards boost,3% capped at $50k/year combined across categories; must select one category; foreign transaction fee; best value with BoA business banking relationship
Alaska Airlines Visa Signature,Bank of America,personal,95,95,95,airline,Alaska,3 / 2 / 1,1.5,"70,000 miles after $3,000 spend in 90 days (typical recent offer)",miles,700,,No,Travelers who regularly fly Alaska and want Companion Fare and free checked bag.,Core Alaska Airlines co-brand for Bank of America customers who want strong airline perks at moderate annual fee.,Annual Companion Fare after meeting spend; free checked bag for you and companions; 3x miles on Alaska purchases; 10% mileage bonus with eligible BoA account; no foreign transaction fees,Best value limited to Alaska route network; miles subject to devaluations; annual Companion Fare requires ongoing spend; few non-travel perks
Atmos Rewards Summit Visa Infinite,Bank of America,personal,395,395,395,airline,Alaska,3 / 1,1.8,"100,000 points after $6,000 spend in 90 days (current launch offer)",points,1000,,No,Frequent Alaska and international travelers who want lounge access and premium companion awards.,Premium Alaska co-brand positioned as a Visa Infinite product for global travelers wanting high-end perks and companion awards.,"Up to two Global Companion Awards per year; Alaska Lounge passes; 3x on dining, foreign and Alaska/Hawaiian purchases; 10% rewards bonus with eligible BoA accounts; no foreign transaction fees; strong travel protections",High $395 annual fee; value depends on frequent Alaska or partner travel; complex companion award and spend thresholds; overkill for casual flyers
U.S. Bank Cash+,U.S. Bank,personal,0,0,0,cashback,,5 / 2 / 1,2.0,200,dollars,200,0% for 12 months,Yes,Highest 5% cash back on two categories you choose each quarter,Category maximization for organized spenders wanting top-tier cash back rates in flexible categories,5% cash back on two categories of choice each quarter; 2% on one everyday category; 1% elsewhere; no annual fee,5% capped at $2000 combined per quarter; requires quarterly category selection; foreign transaction fee; category options narrower than competitors; activation needed
U.S. Bank Unlimited Cash,U.S. Bank,personal,0,0,0,cashback,,1.5,1.5,150,dollars,150,0% for 12 months,Yes,Simple unlimited 1.5% cash back with long intro APR period,Straightforward flat-rate card for set-it-and-forget-it cash back with 0% financing option,Unlimited 1.5% cash back on all purchases; 0% intro APR for 12 months; no annual fee; easy redemption,No bonus categories; lower earning than category-focused cards; foreign transaction fee; $150 welcome bonus requires $1000 spend in first 90 days
Amex Blue Cash Everyday,Amex,personal,0,0,0,cashback,,3 / 2 / 1,1.7,200,dollars,200,0% for 15 months,Yes,Grocery and gas spending with no annual fee for everyday Amex benefits,No-fee cash back card targeting grocery shoppers who want Amex benefits without premium cost,3% cash back at U.S. supermarkets (up to $6k/year); 3% at U.S. gas stations and select transit; 2% at U.S. department stores; 1% elsewhere; no annual fee; 0% intro APR for 15 months,Foreign transaction fee; 3% supermarket bonus capped at $6k/year then 1%; excludes superstores like Walmart/Target; lower rates than Blue Cash Preferred
Amex Blue Cash Preferred,Amex,personal,95,0,95,cashback,,6 / 3 / 1,2.5,300,dollars,300,0% for 12 months,Yes,Heavy grocery spenders wanting industry-leading 6% back at supermarkets,Premium grocery cash back card with best-in-class supermarket earning for high grocery spend households,6% cash back at U.S. supermarkets (up to $6k/year); 6% on select U.S. streaming services; 3% at U.S. gas stations and transit; 3% at U.S. department stores; 1% elsewhere; first year annual fee waived,Annual fee $95 after first year; 6% supermarket capped at $6k/year then 1%; foreign transaction fee; excludes Walmart/Target; requires $3k+ grocery spend annually to beat Blue Cash Everyday
Amex Green,Amex,personal,150,150,150,travel,,,0.5,60000,points,600,,No,Transit dining and travel spenders wanting Membership Rewards without premium annual fee,Entry Membership Rewards charge card for urban lifestyle and moderate travelers who want points flexibility,3× on travel; 3× on transit (including rideshare taxis parking); 3× on dining; 1× elsewhere; transferable Membership Rewards to 20+ airline/hotel partners; CLEAR Plus credit ($189 value); no preset spending limit,Annual fee $150; narrower 3× categories than Gold; must pay in full monthly (charge card); fewer credits than Gold/Platinum; foreign transaction fee on some purchases
Amex Gold,Amex,personal,250,250,250,travel,,,0.5,60000,points,600,,No,Dining and grocery spending for travelers who want strong category multipliers and flexible points,Premium dining and grocery card delivering highest earning in key categories with Membership Rewards transfer power,4× at restaurants worldwide; 4× at U.S. supermarkets (up to $25k/year); 3× on flights; transferable Membership Rewards; $120 Uber Cash annually; $120 dining credits annually,Annual fee $250; credits require active use; 4× supermarket capped at $25k/year then 1×; must pay in full monthly (charge card); complex credit optimization needed
Amex Platinum,Amex,personal,695,695,695,travel,,,0.5,80000,points,800,,No,Luxury travelers wanting premium lounge access elite status and comprehensive travel credits,Flagship premium travel card for frequent flyers prioritizing experience perks and airport lounge access over earning rates,5× on flights booked direct or via Amex Travel; 5× on prepaid hotels via Amex Travel; Centurion Lounge + Priority Pass + Delta Sky Club access; $200 hotel credit; $200 airline credit; automatic hotel elite status; strong travel protections,Annual fee $695; credits are complex and restrictive; 1× earning on most purchases; must pay in full monthly; value requires heavy travel and credit optimization
Barclays JetBlue Premier,Barclays,personal,99,99,99,airline,JetBlue ,,0.5,60000,miles,600,,No,JetBlue frequent flyers wanting free checked bags and bonus TrueBlue points,Mid-tier JetBlue co-brand for regular JetBlue travelers in Northeast and Florida markets,2× on JetBlue purchases; 2× at restaurants and eligible grocery stores; first checked bag free on JetBlue; 5000 bonus points after every anniversary; earns toward Mosaic elite status; no foreign transaction fee,$99 annual fee; best value only with 4+ JetBlue flights/year; TrueBlue limited redemption partners; JetBlue route network constraints; fewer perks than Plus
Barclays JetBlue Plus,Barclays,personal,69,69,69,airline,JetBlue ,,0.5,50000,miles,500,,No,Occasional JetBlue flyers wanting free checked bag at lower annual fee,Entry JetBlue co-brand for light travelers who want basic perks without premium cost,2× on JetBlue purchases; first checked bag free on JetBlue; 5000 bonus points after every anniversary; no foreign transaction fee,$69 annual fee; fewer perks and lower earn than Premier; smaller welcome bonus; best for 2-3 JetBlue trips/year minimum; TrueBlue program limitations
Barclays Frontier Airlines World Mastercard,Barclays,personal,0,0,0,airline,,,0.4,30000,miles,300,,No,Budget airline travelers flying Frontier frequently wanting bag discounts,No-fee ultra-low-cost carrier co-brand for discount-focused Frontier loyalists,No annual fee; companion discount certificate annually; kids fly free offer; bonus miles on Frontier purchases; discounts on bags and other Frontier purchases; no foreign transaction fee,Frontier miles low redemption value; limited route network; no free checked bag; fewer perks than legacy carrier cards; best only for frequent Frontier flyers
Barclays JetBlue Business Card,Barclays,business,99,99,99,airline,JetBlue ,,0.5,70000,miles,700,,No,Small businesses flying JetBlue regularly for client meetings or team travel,JetBlue business co-brand for companies in JetBlue markets wanting TrueBlue earning and perks,2× on JetBlue purchases; 2× at restaurants office supply stores gas stations and eligible telecom; first checked bag free; 5000 anniversary bonus; earns toward Mosaic; no foreign transaction fee,$99 annual fee justified only with regular JetBlue business travel; TrueBlue limited partners; JetBlue route constraints; expense tracking for JetBlue-heavy businesses
Marriott Bonvoy Bevy American Express Card,Amex,personal,250,250,250,hotel,Marriott ,6 / 4 / 2,0.5,100000,points,333,,No,Regular Marriott guests wanting Gold Elite and credits,Mid-premium Marriott Amex with automatic status and anniversary night,6× Marriott; 4× dining gas wireless; 2× other; annual free night; automatic Gold Elite; $150 statement credits,$250 annual fee; free night up to 50k points; value tied to Marriott loyalty
Hilton Honors American Express Aspire Card,Amex,personal,450,450,450,hotel,Hilton ,14 / 7 / 3,0.4,175000,points,583,,No,Frequent Hilton guests seeking Diamond status and resort credits,Premium Hilton card with top-tier status and strong perks package,Diamond status; $250 airline credit; $250 resort credit; Priority Pass; weekend free night; 14× Hilton,$450 annual fee justified only with regular Hilton stays; lower point value than airline miles
American Express Green Card,Amex,personal,150,150,150,travel,,3 / 3 / 1,0.5,50000,points,500,,No,Transit and dining spenders wanting Membership Rewards,Entry charge card for lifestyle + travel with clean design,3× travel transit dining; CLEAR credit; LoungeBuddy passes; transferable Membership Rewards,$150 annual fee; narrower bonus categories than Gold; pay-in-full monthly required
Delta SkyMiles Gold American Express Card,Amex,personal,0,99,99,airline,Delta ,2 / 1,0.5,50000,miles,500,,No,Moderate Delta flyers wanting free bag and early boarding,Mid-tier Delta card with core perks at accessible fee,First year free then $99; 2× Delta restaurants; free first bag; priority boarding,Annual fee after year 1; smaller bonus vs Platinum; best for several Delta trips/year
Hilton Honors American Express Surpass Card,Amex,personal,150,150,150,hotel,Hilton ,12 / 6 / 3,0.4,150000,points,500,,No,Regular Hilton guests seeking high earn rates and automatic Gold status,Mid-tier Hilton card balancing strong multipliers and manageable fee,12× Hilton; 6× groceries gas dining; automatic Gold Elite; weekend night after $15k spend,$150 annual fee; value depends on Hilton footprint; lower point redemption value
Marriott Bonvoy Brilliant American Express Card,Amex,personal,650,650,650,hotel,Marriott ,6 / 3 / 2,0.5,185000,points,616,,No,Heavy Marriott travelers wanting Platinum Elite and luxury credits,Premium Marriott Amex with top-tier status and statement credits,Platinum Elite; $300 Marriott credit; annual free night (up to 85k); Priority Pass; 6× Marriott,$650 annual fee; best for frequent Marriott stays; free night cert is strong value
Delta SkyMiles Platinum American Express Card,Amex,personal,350,350,350,airline,Delta ,3 / 1,0.5,70000,miles,700,,No,Frequent Delta flyers needing companion certificate and lounge access,Premium Delta card with strong perks for regular SkyMiles flyers,Companion certificate (annual); Delta Sky Club discounted access; free bags; priority boarding; 3× Delta,$350 annual fee; companion cert restrictions apply; best for frequent Delta travel
Hilton Honors American Express Business Card,Amex,business,95,95,95,hotel,Hilton ,12 / 6 / 3,0.4,150000,points,500,,No,Small businesses with Hilton stays and category spend,Business Hilton card with strong multipliers and Gold status,12× Hilton; 6× groceries gas wireless shipping; automatic Gold Elite; weekend night after $15k,$95 annual fee; lower point redemption value; best with regular Hilton business travel
Marriott Bonvoy Business American Express Card,Amex,business,125,125,125,hotel,Marriott ,6 / 4 / 2,0.5,100000,points,333,,No,Businesses with Marriott stays seeking Silver Elite,Mid-tier Marriott business card with automatic status and solid multipliers,6× Marriott; 4× dining gas wireless shipping; 2× other; automatic Silver Elite; annual free night,$125 annual fee; free night up to 50k points; value tied to Marriott program engagement
Delta SkyMiles Gold Business American Express Card,Amex,business,0,99,99,airline,Delta ,2 / 1,0.5,60000,miles,600,,No,Small businesses with moderate Delta travel,Entry-mid Delta business card with free first year,First year free then $99; 2× Delta restaurants; free first bag; early boarding,Annual fee after year 1; fewer perks than Platinum; best for several Delta trips annually
Delta SkyMiles Platinum Business American Express Card,Amex,business,350,350,350,airline,Delta ,3 / 1.5 / 1,0.5,90000,miles,900,,No,Frequent Delta business travelers seeking companion certificate,Premium Delta business card with strong perks and earning,Companion certificate (annual); discounted Sky Club access; 3× Delta; 1.5× $5k+ purchases; free bags,$350 annual fee; companion cert restrictions; best for regular Delta business travel
The Business Platinum Card from American Express,Amex,business,695,695,695,travel,,,0.5,150000,points,1500,,No,High-spend businesses needing premium travel benefits and credits,Flagship Amex business card with luxury perks and flexible points,1.5× purchases $5k+; Dell Adobe Indeed credits; Centurion Lounge access; strong travel protections,$695 annual fee; credits require optimization; best for heavy business travel and tech spend
Blue Business Plus Credit Card from American Express,Amex,business,0,0,0,travel,,2,0.5,15000,points,150,,No,Small businesses wanting no-fee Membership Rewards earning,Entry business card with flat Membership Rewards and no annual fee,No annual fee; 2× on all purchases (up to $50k/yr); transferable Membership Rewards; simple structure,2× capped at $50k/year then 1×; lower welcome bonus; no premium perks
